{
  "title": "Knowledge Service Unavailable",
  "timestamp_utc": "2026-03-05T11:23:55.361531+00:00",
  "query": "store: tested note",
  "error": "[Errno 1] Operation not permitted",
  "next_steps": [
    "Start Qdrant: cd infra && docker compose up -d qdrant",
    "Confirm AICL_QDRANT_URL points to a reachable endpoint."
  ]
}